{
  "schema_version": 1,
  "id": "quality-historical-explicit-development",
  "kind": "quality",
  "mode": "agent",
  "split": "development",
  "repetitions": 1,
  "warmup_attempts": 1,
  "prompt": "quality-v3.1.txt",
  "model": "qwen2.5:3b-instruct-q4_K_M",
  "model_digest": "357c53fb659c5076de1d65ccb0b397446227b71a42be9d1603d46168015c9e4b",
  "runtime_version": "0.40.12",
  "endpoint": "http://127.0.0.1:11434/api/generate",
  "think": false,
  "processor": "automatic_acceleration",
  "keep_alive_seconds": 600,
  "request_timeout_seconds": 300,
  "attempt_timeout_seconds": 600,
  "options": {
    "num_ctx": 4096,
    "num_predict": 2048,
    "temperature": 0,
    "seed": 125,
    "num_thread": 6
  }
}
